{
  "$schema": "../../../../schemas/lookup-index.schema.json",
  "schema_version": 1,
  "format": "wkb-pack-v1",
  "source_sha256": "58395aa75307c3ae6d652922abe19c5dccfb9a65144de5672c055f0fecb73c6d",
  "feature_count": 74,
  "features": [
    {
      "name": "africa",
      "geometry_type": "MultiPolygon",
      "bounds": [
        -17.497975,
        -34.785726,
        51.380035,
        37.317299
      ],
      "offset": 0,
      "length": 32671,
      "properties": {
        "name": "africa",
        "kind": "area",
        "nvs_concept_url": "https://vocab.nerc.ac.uk/collection/P30/5/africa/",
        "geometry_source": "Natural Earth geography regions",
        "geometry_source_url": "https://www.naturalearthdata.com/downloads/50m-physical-vectors/50m-physical-labels/",
        "geometry_source_version": "5.0.0",
        "geometry_license": "Public domain",
        "geometry_method": "selected Natural Earth geography region AFRICA",
        "geometry_contexts": [],
        "specificity": 30
      }
    },
    {
      "name": "antarctica",
      "geometry_type": "MultiPolygon",
      "bounds": [
        -179.999989,
        -89.999933,
        180.0,
        -61.076164
      ],
      "offset": 32671,
      "length": 73421,
      "properties": {
        "name": "antarctica",
        "kind": "area",
        "nvs_concept_url": "https://vocab.nerc.ac.uk/collection/P30/5/antarctica/",
        "geometry_source": "Natural Earth geography regions",
        "geometry_source_url": "https://www.naturalearthdata.com/downloads/50m-physical-vectors/50m-physical-labels/",
        "geometry_source_version": "5.0.0",
        "geometry_license": "Public domain",
        "geometry_method": "selected Natural Earth geography region ANTARCTICA",
        "geometry_contexts": [],
        "specificity": 30
      }
    },
    {
      "name": "arabian_sea",
      "geometry_type": "MultiPolygon",
      "bounds": [
        51.021957,
        -0.700931,
        74.171135,
        25.625385
      ],
      "offset": 106092,
      "length": 122627,
      "properties": {
        "name": "arabian_sea",
        "kind": "area",
        "nvs_concept_url": "https://vocab.nerc.ac.uk/collection/P30/5/arabian_sea/",
        "geometry_source": "SeaVoX Salt and Fresh Water Body Gazetteer polygons",
        "geometry_source_url": "https://doi.org/10.14284/590",
        "geometry_source_version": "19",
        "geometry_license": "CC BY 4.0",
        "geometry_method": "dissolved all SeaVoX v19 features where mrgid_sr=24074",
        "geometry_contexts": [],
        "specificity": 70
      }
    },
    {
      "name": "aral_sea",
      "geometry_type": "Polygon",
      "bounds": [
        58.178301,
        43.390601,
        61.9726,
        46.8733
      ],
      "offset": 228719,
      "length": 19805,
      "properties": {
        "name": "aral_sea",
        "kind": "area",
        "nvs_concept_url": "https://vocab.nerc.ac.uk/collection/P30/5/aral_sea/",
        "geometry_source": "SeaVoX Salt and Fresh Water Body Gazetteer polygons",
        "geometry_source_url": "https://doi.org/10.14284/590",
        "geometry_source_version": "19",
        "geometry_license": "CC BY 4.0",
        "geometry_method": "dissolved all SeaVoX v19 features where mrgid_sr=24176",
        "geometry_contexts": [],
        "specificity": 70
      }
    },
    {
      "name": "arctic_ocean",
      "geometry_type": "MultiPolygon",
      "bounds": [
        -180.0,
        51.132549,
        180.0,
        90.000053
      ],
      "offset": 248524,
      "length": 6658783,
      "properties": {
        "name": "arctic_ocean",
        "kind": "area",
        "nvs_concept_url": "https://vocab.nerc.ac.uk/collection/P30/5/arctic_ocean/",
        "geometry_source": "SeaVoX Salt and Fresh Water Body Gazetteer polygons",
        "geometry_source_url": "https://doi.org/10.14284/590",
        "geometry_source_version": "19",
        "geometry_license": "CC BY 4.0",
        "geometry_method": "dissolved all SeaVoX v19 features where mrgid_r=23617",
        "geometry_contexts": [],
        "specificity": 30
      }
    },
    {
      "name": "asia",
      "geometry_type": "MultiPolygon",
      "bounds": [
        -180.0,
        1.265381,
        179.98779,
        81.280469
      ],
      "offset": 6907307,
      "length": 165397,
      "properties": {
        "name": "asia",
        "kind": "area",
        "nvs_concept_url": "https://vocab.nerc.ac.uk/collection/P30/5/asia/",
        "geometry_source": "Natural Earth geography regions",
        "geometry_source_url": "https://www.naturalearthdata.com/downloads/50m-physical-vectors/50m-physical-labels/",
        "geometry_source_version": "5.0.0",
        "geometry_license": "Public domain",
        "geometry_method": "selected Natural Earth geography region ASIA",
        "geometry_contexts": [],
        "specificity": 30
      }
    },
    {
      "name": "atlantic_arctic_ocean",
      "geometry_type": "MultiPolygon",
      "bounds": [
        -180.0,
        -60.0,
        180.0,
        90.000053
      ],
      "offset": 7072704,
      "length": 11390897,
      "properties": {
        "name": "atlantic_arctic_ocean",
        "kind": "area",
        "nvs_concept_url": "https://vocab.nerc.ac.uk/collection/P30/5/CFSRLAAO/",
        "geometry_source": "cf-regions derived geometry",
        "geometry_source_url": "https://cfconventions.org/Data/standardized-region-list/standardized-region-list.5.xml",
        "geometry_source_version": "2026.09.1",
        "geometry_license": "Derived from CC BY 4.0 and/or public-domain geometries",
        "geometry_method": "union of the SeaVoX Atlantic and Arctic interpretations",
        "geometry_contexts": [],
        "specificity": 20
      }
    },
    {
      "name": "atlantic_ocean",
      "geometry_type": "MultiPolygon",
      "bounds": [
        -97.89119,
        -60.0,
        20.000016,
        67.947914
      ],
      "offset": 18463601,
      "length": 4736596,
      "properties": {
        "name": "atlantic_ocean",
        "kind": "area",
        "nvs_concept_url": "https://vocab.nerc.ac.uk/collection/P30/5/atlantic_ocean/",
        "geometry_source": "SeaVoX Salt and Fresh Water Body Gazetteer polygons",
        "geometry_source_url": "https://doi.org/10.14284/590",
        "geometry_source_version": "19",
        "geometry_license": "CC BY 4.0",
        "geometry_method": "dissolved all SeaVoX v19 features where mrgid_r=23618",
        "geometry_contexts": [],
        "specificity": 30
      }
    },
    {
      "name": "australia",
      "geometry_type": "MultiPolygon",
      "bounds": [
        112.908203,
        -43.619336,
        153.616895,
        -10.051758
      ],
      "offset": 23200197,
      "length": 29134,
      "properties": {
        "name": "australia",
        "kind": "area",
        "nvs_concept_url": "https://vocab.nerc.ac.uk/collection/P30/5/australia/",
        "geometry_source": "Natural Earth geography regions",
        "geometry_source_url": "https://www.naturalearthdata.com/downloads/50m-physical-vectors/50m-physical-labels/",
        "geometry_source_version": "5.0.0",
        "geometry_license": "Public domain",
        "geometry_method": "selected Natural Earth geography region AUSTRALIA",
        "geometry_contexts": [],
        "specificity": 30
      }
    },
    {
      "name": "baltic_sea",
      "geometry_type": "MultiPolygon",
      "bounds": [
        9.4208,
        53.6017,
        30.3467,
        65.9059
      ],
      "offset": 23229331,
      "length": 1435862,
      "properties": {
        "name": "baltic_sea",
        "kind": "area",
        "nvs_concept_url": "https://vocab.nerc.ac.uk/collection/P30/5/baltic_sea/",
        "geometry_source": "SeaVoX Salt and Fresh Water Body Gazetteer polygons",
        "geometry_source_url": "https://doi.org/10.14284/590",
        "geometry_source_version": "19",
        "geometry_license": "CC BY 4.0",
        "geometry_method": "dissolved all SeaVoX v19 features where mrgid_r=23619",
        "geometry_contexts": [],
        "specificity": 70
      }
    },
    {
      "name": "barents_opening",
      "geometry_type": "LineString",
      "bounds": [
        16.8,
        70.2,
        19.2,
        76.5
      ],
      "offset": 24665193,
      "length": 41,
      "properties": {
        "name": "barents_opening",
        "kind": "section",
        "nvs_concept_url": "https://vocab.nerc.ac.uk/collection/P30/5/cfbarope/",
        "geometry_source": "OMIP protocol Table J1",
        "geometry_source_url": "https://doi.org/10.5194/gmd-9-3231-2016",
        "geometry_source_version": "2016 / CMIP6",
        "geometry_license": "CC BY 3.0",
        "geometry_method": "approximate diagnostic section endpoints",
        "geometry_contexts": [],
        "specificity": 100
      }
    },
    {
      "name": "barents_sea",
      "geometry_type": "Polygon",
      "bounds": [
        16.269718,
        66.816452,
        68.589188,
        81.828568
      ],
      "offset": 24665234,
      "length": 369625,
      "properties": {
        "name": "barents_sea",
        "kind": "area",
        "nvs_concept_url": "https://vocab.nerc.ac.uk/collection/P30/5/barents_sea/",
        "geometry_source": "SeaVoX Salt and Fresh Water Body Gazetteer polygons",
        "geometry_source_url": "https://doi.org/10.14284/590",
        "geometry_source_version": "19",
        "geometry_license": "CC BY 4.0",
        "geometry_method": "dissolved all SeaVoX v19 features where mrgid_sr=24029",
        "geometry_contexts": [],
        "specificity": 70
      }
    },
    {
      "name": "beaufort_sea",
      "geometry_type": "MultiPolygon",
      "bounds": [
        -156.640976,
        68.639938,
        -122.60453,
        76.345772
      ],
      "offset": 25034859,
      "length": 151569,
      "properties": {
        "name": "beaufort_sea",
        "kind": "area",